<?xml version="1.0" encoding="UTF-8"?>
<xs:schema xmlns:xs="http://www.w3.org/2001/XMLSchema"
           xmlns:u="https://github.com/milica152/XML_tim27"
           targetNamespace="https://github.com/milica152/XML_tim27" elementFormDefault="qualified">
    <xs:element name="users">
        <xs:complexType>
            <xs:sequence>
                <xs:element name="user" maxOccurs="unbounded" minOccurs="0" type="u:TUser"/>
            </xs:sequence>
        </xs:complexType>
    </xs:element>
    <xs:complexType name="TUser">
        <xs:sequence>
            <xs:element name="username">
                <xs:simpleType>
                    <xs:restriction base="xs:string">
                        <xs:maxLength value="25"/>
                    </xs:restriction>
                </xs:simpleType>
            </xs:element>
            <xs:element name="password">
                <xs:simpleType>
                    <xs:restriction base="xs:string">
                        <xs:minLength value="4"/>
                    </xs:restriction>
                </xs:simpleType>
            </xs:element>
            <xs:element name="name">
                <xs:simpleType>
                    <xs:restriction base="xs:string">
                        <xs:maxLength value="50"/>
                    </xs:restriction>
                </xs:simpleType>
            </xs:element>
            <xs:element name="surname" type="xs:string"/>
            <xs:element name="email">
                <xs:simpleType>
                    <xs:restriction base="xs:string">
                        <xs:pattern value="^[_A-Za-z0-9-+]+(\.[_A-Za-z0-9-]+)*@[A-Za-z0-9-]+(\.[A-Za-z0-9]+)*(\.[A-Za-z]{2,})$"/>
                    </xs:restriction>
                </xs:simpleType>
            </xs:element>
            <xs:element name="profession" type="xs:string"/>
            <xs:element name="myPapers">
                <xs:complexType>
                    <xs:sequence>
                        <xs:element maxOccurs="unbounded" minOccurs="0" name="myScientificPaperID"
                                    type="xs:string"/>
                    </xs:sequence>
                </xs:complexType>
            </xs:element>
            <xs:element name="myReviews">
                <xs:complexType>
                    <xs:sequence>
                        <xs:element maxOccurs="unbounded" minOccurs="0" name="myReviewID"
                                    type="xs:string"/>
                    </xs:sequence>
                </xs:complexType>
            </xs:element>
            <xs:element name="pendingPapersToReview">
                <xs:complexType>
                    <xs:sequence>
                        <xs:element maxOccurs="unbounded" minOccurs="0" name="paperToReviewID"
                                    type="xs:string"/>
                    </xs:sequence>
                </xs:complexType>
            </xs:element>
            <xs:element name="role" type="u:TRole"/>
        </xs:sequence>
    </xs:complexType>
    <xs:simpleType name="TRole">
        <xs:restriction base="xs:string">
            <xs:enumeration value="author"/>
            <xs:enumeration value="editor"/>
            <xs:enumeration value="reviewer"/>
        </xs:restriction>
    </xs:simpleType>
</xs:schema>
